"BWPDX106","Best Western Inn At Meadows","1215 N Hayden Meadows Drive","Portland","OR","97217","87.19","SRS","C1K","No","Room with bath - Standard","King","1","20190128"
"LQPDX265","La Quinta Inn Ste Portland Airport","11207 Ne Holman St","Portland","OR","97220","94.0","RAC","C1D","No","Room with bath - Standard","Double","1","20190128"
"WXPDXBEN","The Benson. A Coast Hotel","309 S.w.broadway","Portland","OR","97205","117.0","UU2","A2D","No","Room with bath - Superior","Double","2","20190128"
"LQPDX465","La Quinta Inn Ste Portland Nw","4319 Nw Yeon","Portland","OR","97210","119.0","RAC","H1K","No","Room with shower - Minimum","King","1","20190128"
"CXPDX962","Country Inn Suites Portland","7025 Ne Alderwood Rd","Portland","OR","97218","130.5","AAA","H1K","No","Room with shower - Minimum","King","1","20190128"
"RLPDX130","Red Lion Hotel On The River Jantzen Beac","909 N Hayden Island Drive","Portland","OR","97217","143.65","ARP","R2Q","No","unknown","Queen","2","20190128"
"ESPDXB3A","Embassy Ste Portland Washington","9000 Sw Washington Square","Tigard","OR","97223","146.28","PRO","G1K","No","Room with shower - Standard","King","1","20190128"
"HXPDXGE0","Hampton Inn  Portland Airport","8633 Ne Airport Frwy","Portland","OR","97220","161.1","AAA","W1K","No","Room at weekend rate","King","1","20190128"
